{
  "schema_version": 1,
  "id": "receipt-20260717T073450.451Z-e5f04069da4d0801",
  "producer": "beforedone.check",
  "check_id": "unit",
  "argv": [
    "go",
    "test",
    "./..."
  ],
  "working_directory": ".",
  "started_at": "2026-07-17T07:34:20.0752832Z",
  "finished_at": "2026-07-17T07:34:47.966949Z",
  "exit_code": 0,
  "verdict": "PASS",
  "git_commit": "0031474c33f4587fb70bc5a73d6b712aa220d2ef",
  "relevant_fingerprint": "sha256:542199c8dbabc9f226a4d857304933b172680b878c6f8ed4b4391301e0f45a41",
  "relevant_file_count": 3,
  "stdout_summary": "ok  \texample.com/beforedone-demo\t1.164s",
  "log_path": "logs/check-20260717T073450.449Z-b04fef0bbe2e5074.log",
  "log_sha256": "sha256:ef3841b7b28d5d5ccc449ed9dda4f7fd5ef90b79508b60ff3dcc3d7ec4ac493d",
  "beforedone_version": "dev",
  "signature": "hmac-sha256:82cc6cb561bb9be5fa78f04761228c08b31238dd324d0f548e50a37439b087d5"
}
